{
  "$defs": {
    "BootstrapIntervalV1": {
      "additionalProperties": false,
      "properties": {
        "confidence": {
          "exclusiveMaximum": 1.0,
          "exclusiveMinimum": 0.0,
          "title": "Confidence",
          "type": "number"
        },
        "estimate": {
          "title": "Estimate",
          "type": "number"
        },
        "high": {
          "title": "High",
          "type": "number"
        },
        "low": {
          "title": "Low",
          "type": "number"
        },
        "resamples": {
          "minimum": 1,
          "title": "Resamples",
          "type": "integer"
        },
        "seed": {
          "title": "Seed",
          "type": "integer"
        }
      },
      "required": [
        "estimate",
        "low",
        "high",
        "confidence",
        "resamples",
        "seed"
      ],
      "title": "BootstrapIntervalV1",
      "type": "object"
    }
  },
  "$schema": "https://json-schema.org/draft/2020-12/schema",
  "additionalProperties": false,
  "properties": {
    "cohort_manifest_sha256": {
      "pattern": "^[0-9a-f]{64}$",
      "title": "Cohort Manifest Sha256",
      "type": "string"
    },
    "cohort_size": {
      "minimum": 0,
      "title": "Cohort Size",
      "type": "integer"
    },
    "common_valid_tokens": {
      "minimum": 0,
      "title": "Common Valid Tokens",
      "type": "integer"
    },
    "intervals": {
      "additionalProperties": {
        "additionalProperties": {
          "$ref": "#/$defs/BootstrapIntervalV1"
        },
        "type": "object"
      },
      "title": "Intervals",
      "type": "object"
    },
    "protocol_sha256": {
      "pattern": "^[0-9a-f]{64}$",
      "title": "Protocol Sha256",
      "type": "string"
    },
    "schema_version": {
      "const": "aeb-intervals/v1",
      "title": "Schema Version",
      "type": "string"
    }
  },
  "required": [
    "schema_version",
    "protocol_sha256",
    "cohort_manifest_sha256",
    "cohort_size",
    "common_valid_tokens",
    "intervals"
  ],
  "title": "AEBIntervalsV1",
  "type": "object"
}
