{
  "cohort_manifest_sha256": "65e38df24b91786fb773b883e1cad4348c0cdc58ac976c729871c77e9478daf9",
  "cohort_size": 344,
  "common_valid_tokens": 344,
  "intervals": {
    "coalition-dropout+latency": {
      "collision_indicator": {
        "confidence": 0.95,
        "estimate": 0.028100775193798454,
        "high": 0.045542635658914726,
        "low": 0.013565891472868215,
        "resamples": 5000,
        "seed": 20260831
      },
      "false_interventions": {
        "confidence": 0.95,
        "estimate": 2.8953488372093013,
        "high": 3.130813953488369,
        "low": 2.671487403100773,
        "resamples": 5000,
        "seed": 20260831
      },
      "intervention_duration_s": {
        "confidence": 0.95,
        "estimate": 9.275387596899224,
        "high": 9.599825581395342,
        "low": 8.940876937984488,
        "resamples": 5000,
        "seed": 20260831
      },
      "missed_interventions": {
        "confidence": 0.95,
        "estimate": 1.4777131782945725,
        "high": 1.6424418604651163,
        "low": 1.325581395348837,
        "resamples": 5000,
        "seed": 20260831
      }
    },
    "coalition-dropout+latency+track_instability": {
      "collision_indicator": {
        "confidence": 0.95,
        "estimate": 0.03197674418604652,
        "high": 0.051356589147286816,
        "low": 0.015503875968992248,
        "resamples": 5000,
        "seed": 20260831
      },
      "false_interventions": {
        "confidence": 0.95,
        "estimate": 2.9486434108527124,
        "high": 3.1686531007751952,
        "low": 2.7296511627906996,
        "resamples": 5000,
        "seed": 20260831
      },
      "intervention_duration_s": {
        "confidence": 0.95,
        "estimate": 9.217441860465115,
        "high": 9.539372577519377,
        "low": 8.884161821705419,
        "resamples": 5000,
        "seed": 20260831
      },
      "missed_interventions": {
        "confidence": 0.95,
        "estimate": 1.5184108527131768,
        "high": 1.6860465116279066,
        "low": 1.363372093023256,
        "resamples": 5000,
        "seed": 20260831
      }
    },
    "coalition-dropout+localization_shape": {
      "collision_indicator": {
        "confidence": 0.95,
        "estimate": 0.0,
        "high": 0.0,
        "low": 0.0,
        "resamples": 5000,
        "seed": 20260831
      },
      "false_interventions": {
        "confidence": 0.95,
        "estimate": 4.880813953488372,
        "high": 5.427325581395343,
        "low": 4.331371124031004,
        "resamples": 5000,
        "seed": 20260831
      },
      "intervention_duration_s": {
        "confidence": 0.95,
        "estimate": 13.559980620155025,
        "high": 13.735077519379848,
        "low": 13.380515988372094,
        "resamples": 5000,
        "seed": 20260831
      },
      "missed_interventions": {
        "confidence": 0.95,
        "estimate": 2.6850775193798455,
        "high": 3.013565891472868,
        "low": 2.3788759689922485,
        "resamples": 5000,
        "seed": 20260831
      }
    },
    "coalition-dropout+localization_shape+latency": {
      "collision_indicator": {
        "confidence": 0.95,
        "estimate": 0.0,
        "high": 0.0,
        "low": 0.0,
        "resamples": 5000,
        "seed": 20260831
      },
      "false_interventions": {
        "confidence": 0.95,
        "estimate": 4.668604651162792,
        "high": 5.160852713178293,
        "low": 4.180208333333331,
        "resamples": 5000,
        "seed": 20260831
      },
      "intervention_duration_s": {
        "confidence": 0.95,
        "estimate": 13.28934108527131,
        "high": 13.475586240310067,
        "low": 13.087582364341076,
        "resamples": 5000,
        "seed": 20260831
      },
      "missed_interventions": {
        "confidence": 0.95,
        "estimate": 2.6249999999999987,
        "high": 2.9428536821705427,
        "low": 2.335271317829459,
        "resamples": 5000,
        "seed": 20260831
      }
    },
    "coalition-dropout+localization_shape+latency+track_instability": {
      "collision_indicator": {
        "confidence": 0.95,
        "estimate": 0.0,
        "high": 0.0,
        "low": 0.0,
        "resamples": 5000,
        "seed": 20260831
      },
      "false_interventions": {
        "confidence": 0.95,
        "estimate": 4.729651162790699,
        "high": 5.2151162790697665,
        "low": 4.24125484496124,
        "resamples": 5000,
        "seed": 20260831
      },
      "intervention_duration_s": {
        "confidence": 0.95,
        "estimate": 13.265503875968989,
        "high": 13.451841085271315,
        "low": 13.063846899224808,
        "resamples": 5000,
        "seed": 20260831
      },
      "missed_interventions": {
        "confidence": 0.95,
        "estimate": 2.60174418604651,
        "high": 2.920566860465119,
        "low": 2.31296027131783,
        "resamples": 5000,
        "seed": 20260831
      }
    },
    "coalition-dropout+localization_shape+track_instability": {
      "collision_indicator": {
        "confidence": 0.95,
        "estimate": 0.0,
        "high": 0.0,
        "low": 0.0,
        "resamples": 5000,
        "seed": 20260831
      },
      "false_interventions": {
        "confidence": 0.95,
        "estimate": 4.953488372093023,
        "high": 5.505862403100772,
        "low": 4.400096899224804,
        "resamples": 5000,
        "seed": 20260831
      },
      "intervention_duration_s": {
        "confidence": 0.95,
        "estimate": 13.534302325581395,
        "high": 13.711734496124022,
        "low": 13.352218992248066,
        "resamples": 5000,
        "seed": 20260831
      },
      "missed_interventions": {
        "confidence": 0.95,
        "estimate": 2.656007751937983,
        "high": 2.9815891472868206,
        "low": 2.3536821705426347,
        "resamples": 5000,
        "seed": 20260831
      }
    },
    "coalition-dropout+track_instability": {
      "collision_indicator": {
        "confidence": 0.95,
        "estimate": 0.022286821705426358,
        "high": 0.036821705426356585,
        "low": 0.010658914728682169,
        "resamples": 5000,
        "seed": 20260831
      },
      "false_interventions": {
        "confidence": 0.95,
        "estimate": 3.1317829457364366,
        "high": 3.359520348837211,
        "low": 2.903100775193797,
        "resamples": 5000,
        "seed": 20260831
      },
      "intervention_duration_s": {
        "confidence": 0.95,
        "estimate": 9.478585271317828,
        "high": 9.793510174418607,
        "low": 9.158619186046508,
        "resamples": 5000,
        "seed": 20260831
      },
      "missed_interventions": {
        "confidence": 0.95,
        "estimate": 1.2713178294573644,
        "high": 1.4379844961240307,
        "low": 1.117223837209302,
        "resamples": 5000,
        "seed": 20260831
      }
    },
    "coalition-latency+track_instability": {
      "collision_indicator": {
        "confidence": 0.95,
        "estimate": 0.030038759689922482,
        "high": 0.04844961240310078,
        "low": 0.014534883720930232,
        "resamples": 5000,
        "seed": 20260831
      },
      "false_interventions": {
        "confidence": 0.95,
        "estimate": 2.477713178294574,
        "high": 2.7209302325581395,
        "low": 2.25,
        "resamples": 5000,
        "seed": 20260831
      },
      "intervention_duration_s": {
        "confidence": 0.95,
        "estimate": 9.304651162790702,
        "high": 9.633045058139535,
        "low": 8.963650678294576,
        "resamples": 5000,
        "seed": 20260831
      },
      "missed_interventions": {
        "confidence": 0.95,
        "estimate": 1.4525193798449607,
        "high": 1.6289001937984493,
        "low": 1.2877906976744184,
        "resamples": 5000,
        "seed": 20260831
      }
    },
    "coalition-localization_shape+latency": {
      "collision_indicator": {
        "confidence": 0.95,
        "estimate": 0.0,
        "high": 0.0,
        "low": 0.0,
        "resamples": 5000,
        "seed": 20260831
      },
      "false_interventions": {
        "confidence": 0.95,
        "estimate": 4.165697674418604,
        "high": 4.646342054263564,
        "low": 3.69670542635659,
        "resamples": 5000,
        "seed": 20260831
      },
      "intervention_duration_s": {
        "confidence": 0.95,
        "estimate": 13.410755813953486,
        "high": 13.59012112403101,
        "low": 13.216375968992258,
        "resamples": 5000,
        "seed": 20260831
      },
      "missed_interventions": {
        "confidence": 0.95,
        "estimate": 2.7393410852713163,
        "high": 3.0620397286821706,
        "low": 2.4418362403100766,
        "resamples": 5000,
        "seed": 20260831
      }
    },
    "coalition-localization_shape+latency+track_instability": {
      "collision_indicator": {
        "confidence": 0.95,
        "estimate": 0.0,
        "high": 0.0,
        "low": 0.0,
        "resamples": 5000,
        "seed": 20260831
      },
      "false_interventions": {
        "confidence": 0.95,
        "estimate": 4.262596899224805,
        "high": 4.7412790697674385,
        "low": 3.791666666666669,
        "resamples": 5000,
        "seed": 20260831
      },
      "intervention_duration_s": {
        "confidence": 0.95,
        "estimate": 13.380426356589153,
        "high": 13.559324127906983,
        "low": 13.182843992248063,
        "resamples": 5000,
        "seed": 20260831
      },
      "missed_interventions": {
        "confidence": 0.95,
        "estimate": 2.696705426356588,
        "high": 3.019404069767441,
        "low": 2.3992248062015507,
        "resamples": 5000,
        "seed": 20260831
      }
    },
    "coalition-localization_shape+track_instability": {
      "collision_indicator": {
        "confidence": 0.95,
        "estimate": 0.0,
        "high": 0.0,
        "low": 0.0,
        "resamples": 5000,
        "seed": 20260831
      },